{
  "kind": "AIFCanonicalDataModelBundle",
  "schema_version": "aif/0.1",
  "receipt_id": "rcpt-template-001",
  "request": {
    "request_id": "req-001",
    "actor": "arena-agent",
    "repository": "owner/repo",
    "target_ref": "refs/heads/main",
    "requested_actions": ["INSPECT", "VERIFY"],
    "authority_events": ["auth-evt-001"],
    "acceptance_expression": {
      "op": "ALL",
      "expressions": [
        { "op": "CLAIM", "claim_id": "claim-001" }
      ]
    },
    "constraints": [],
    "created_at": "2026-09-29T12:00:00Z"
  },
  "admission": {
    "request_id": "req-001",
    "admission_status": "ADMITTED",
    "admitted_actions": ["INSPECT", "VERIFY"],
    "admitted_paths": ["**"],
    "excluded_actions": [],
    "excluded_paths": [".git/**"],
    "blockers": [],
    "clarifications": [],
    "authority_refs": ["auth-evt-001"],
    "intake_snapshot": "snap-s0-intake"
  },
  "snapshots": [],
  "authority_events": [],
  "execution_records": [],
  "change_records": [],
  "claims": [],
  "evidence": [],
  "coverage": [],
  "verifications": [],
  "findings": [],
  "acceptance_expression": {
    "op": "ALL",
    "expressions": [
      { "op": "CLAIM", "claim_id": "claim-001" }
    ]
  },
  "completion_result": {
    "request_id": "req-001",
    "acceptance_expression": {
      "op": "ALL",
      "expressions": [
        { "op": "CLAIM", "claim_id": "claim-001" }
      ]
    },
    "status": "UNVERIFIED",
    "evaluated_claims": ["claim-001"],
    "satisfied_requirements": [],
    "unmet_requirements": ["claim-001"],
    "blockers": [],
    "unknowns": ["claim-001"],
    "evidence_refs": [],
    "evaluated_snapshot": "snap-s0-intake",
    "generated_at": "2026-09-29T12:00:00Z"
  },
  "generated_at": "2026-09-29T12:00:00Z"
}
